{"$schema":"https://json-schema.org/draft/2020-12/schema","title":"Bit Beast and special move presentation pair","type":"object","required":["pair_id","bit_beast","special_move","confidence"],"properties":{"pair_id":{"type":"integer","minimum":0,"maximum":31},"bit_beast":{"type":"object"},"special_move":{"type":"object"},"confidence":{"enum":["confirmed","strongly_supported","candidate","unknown"]}}}
