[
  {
    "pair_id": 0,
    "bit_beast": {
      "kind": "bit_beast",
      "source_offset": "0x00079CF4",
      "runtime_address": "0x08079CF4",
      "pointers": [
        "0x0833CC60",
        "0x0833CC60",
        "0x0833CC60",
        "0x0833CC60",
        "0x0833CC60"
      ],
      "names": {
        "english": "Dragoon",
        "french": "Dragoon",
        "german": "Dragoon",
        "italian": "Dragoon",
        "spanish": "Dragoon"
      }
    },
    "special_move": {
      "kind": "special_move",
      "source_offset": "0x00079D08",
      "runtime_address": "0x08079D08",
      "pointers": [
        "0x0833CB04",
        "0x0833CB04",
        "0x0833CB04",
        "0x0833CB04",
        "0x0833CB04"
      ],
      "names": {
        "english": "Gaia Storm",
        "french": "Gaia Storm",
        "german": "Gaia Storm",
        "italian": "Gaia Storm",
        "spanish": "Gaia Storm"
      }
    },
    "confidence": "strongly_supported"
  },
  {
    "pair_id": 1,
    "bit_beast": {
      "kind": "bit_beast",
      "source_offset": "0x00079D1C",
      "runtime_address": "0x08079D1C",
      "pointers": [
        "0x0833CC38",
        "0x0833CC38",
        "0x0833CC38",
        "0x0833CC38",
        "0x0833CC38"
      ],
      "names": {
        "english": "Driger",
        "french": "Driger",
        "german": "Driger",
        "italian": "Driger",
        "spanish": "Driger"
      }
    },
    "special_move": {
      "kind": "special_move",
      "source_offset": "0x00079D30",
      "runtime_address": "0x08079D30",
      "pointers": [
        "0x0833CBA4",
        "0x0833CBA4",
        "0x0833CBA4",
        "0x0833CBA4",
        "0x0833CBA4"
      ],
      "names": {
        "english": "Driger Slash",
        "french": "Driger Slash",
        "german": "Driger Slash",
        "italian": "Driger Slash",
        "spanish": "Driger Slash"
      }
    },
    "confidence": "strongly_supported"
  },
  {
    "pair_id": 2,
    "bit_beast": {
      "kind": "bit_beast",
      "source_offset": "0x00079D44",
      "runtime_address": "0x08079D44",
      "pointers": [
        "0x0833CC38",
        "0x0833CC38",
        "0x0833CC38",
        "0x0833CC38",
        "0x0833CC38"
      ],
      "names": {
        "english": "Driger",
        "french": "Driger",
        "german": "Driger",
        "italian": "Driger",
        "spanish": "Driger"
      }
    },
    "special_move": {
      "kind": "special_move",
      "source_offset": "0x00079D58",
      "runtime_address": "0x08079D58",
      "pointers": [
        "0x0833CAF4",
        "0x0833CAF4",
        "0x0833CAF4",
        "0x0833CAF4",
        "0x0833CAF4"
      ],
      "names": {
        "english": "Driger Disaster",
        "french": "Driger Disaster",
        "german": "Driger Disaster",
        "italian": "Driger Disaster",
        "spanish": "Driger Disaster"
      }
    },
    "confidence": "strongly_supported"
  },
  {
    "pair_id": 3,
    "bit_beast": {
      "kind": "bit_beast",
      "source_offset": "0x00079D6C",
      "runtime_address": "0x08079D6C",
      "pointers": [
        "0x0833CAEC",
        "0x0833CAEC",
        "0x0833CAEC",
        "0x0833CAEC",
        "0x0833CAEC"
      ],
      "names": {
        "english": "Stinger",
        "french": "Stinger",
        "german": "Stinger",
        "italian": "Stinger",
        "spanish": "Stinger"
      }
    },
    "special_move": {
      "kind": "special_move",
      "source_offset": "0x00079D80",
      "runtime_address": "0x08079D80",
      "pointers": [
        "0x0833CADC",
        "0x0833CADC",
        "0x0833CADC",
        "0x0833CADC",
        "0x0833CADC"
      ],
      "names": {
        "english": "Stinger Strike",
        "french": "Stinger Strike",
        "german": "Stinger Strike",
        "italian": "Stinger Strike",
        "spanish": "Stinger Strike"
      }
    },
    "confidence": "strongly_supported"
  },
  {
    "pair_id": 4,
    "bit_beast": {
      "kind": "bit_beast",
      "source_offset": "0x00079D94",
      "runtime_address": "0x08079D94",
      "pointers": [
        "0x0833CAD4",
        "0x0833CAD4",
        "0x0833CAD4",
        "0x0833CAD4",
        "0x0833CAD4"
      ],
      "names": {
        "english": "Grip",
        "french": "Grip",
        "german": "Grip",
        "italian": "Grip",
        "spanish": "Grip"
      }
    },
    "special_move": {
      "kind": "special_move",
      "source_offset": "0x00079DA8",
      "runtime_address": "0x08079DA8",
      "pointers": [
        "0x0833CAC4",
        "0x0833CAC4",
        "0x0833CAC4",
        "0x0833CAC4",
        "0x0833CAC4"
      ],
      "names": {
        "english": "Grip Force Stun",
        "french": "Grip Force Stun",
        "german": "Grip Force Stun",
        "italian": "Grip Force Stun",
        "spanish": "Grip Force Stun"
      }
    },
    "confidence": "strongly_supported"
  },
  {
    "pair_id": 5,
    "bit_beast": {
      "kind": "bit_beast",
      "source_offset": "0x00079DBC",
      "runtime_address": "0x08079DBC",
      "pointers": [
        "0x0833CCC8",
        "0x0833CCC8",
        "0x0833CCC8",
        "0x0833CCC8",
        "0x0833CCC8"
      ],
      "names": {
        "english": "Saizo",
        "french": "Saizo",
        "german": "Saizo",
        "italian": "Saizo",
        "spanish": "Saizo"
      }
    },
    "special_move": {
      "kind": "special_move",
      "source_offset": "0x00079DD0",
      "runtime_address": "0x08079DD0",
      "pointers": [
        "0x0833CAB0",
        "0x0833CAB0",
        "0x0833CAB0",
        "0x0833CAB0",
        "0x0833CAB0"
      ],
      "names": {
        "english": "Super Saizo Sting",
        "french": "Super Saizo Sting",
        "german": "Super Saizo Sting",
        "italian": "Super Saizo Sting",
        "spanish": "Super Saizo Sting"
      }
    },
    "confidence": "strongly_supported"
  },
  {
    "pair_id": 6,
    "bit_beast": {
      "kind": "bit_beast",
      "source_offset": "0x00079DE4",
      "runtime_address": "0x08079DE4",
      "pointers": [
        "0x0833CAA8",
        "0x0833CAA8",
        "0x0833CAA8",
        "0x0833CAA8",
        "0x0833CAA8"
      ],
      "names": {
        "english": "Roller",
        "french": "Roller",
        "german": "Roller",
        "italian": "Roller",
        "spanish": "Roller"
      }
    },
    "special_move": {
      "kind": "special_move",
      "source_offset": "0x00079DF8",
      "runtime_address": "0x08079DF8",
      "pointers": [
        "0x0833CA98",
        "0x0833CA98",
        "0x0833CA98",
        "0x0833CA98",
        "0x0833CA98"
      ],
      "names": {
        "english": "Roller Recoil",
        "french": "Roller Recoil",
        "german": "Roller Recoil",
        "italian": "Roller Recoil",
        "spanish": "Roller Recoil"
      }
    },
    "confidence": "strongly_supported"
  },
  {
    "pair_id": 7,
    "bit_beast": {
      "kind": "bit_beast",
      "source_offset": "0x00079E0C",
      "runtime_address": "0x08079E0C",
      "pointers": [
        "0x0833CAA8",
        "0x0833CAA8",
        "0x0833CAA8",
        "0x0833CAA8",
        "0x0833CAA8"
      ],
      "names": {
        "english": "Roller",
        "french": "Roller",
        "german": "Roller",
        "italian": "Roller",
        "spanish": "Roller"
      }
    },
    "special_move": {
      "kind": "special_move",
      "source_offset": "0x00079E20",
      "runtime_address": "0x08079E20",
      "pointers": [
        "0x0833CA88",
        "0x0833CA88",
        "0x0833CA88",
        "0x0833CA88",
        "0x0833CA88"
      ],
      "names": {
        "english": "Roller Repel",
        "french": "Roller Repel",
        "german": "Roller Repel",
        "italian": "Roller Repel",
        "spanish": "Roller Repel"
      }
    },
    "confidence": "strongly_supported"
  },
  {
    "pair_id": 8,
    "bit_beast": {
      "kind": "bit_beast",
      "source_offset": "0x00079E34",
      "runtime_address": "0x08079E34",
      "pointers": [
        "0x0833CA80",
        "0x0833CA80",
        "0x0833CA80",
        "0x0833CA80",
        "0x0833CA80"
      ],
      "names": {
        "english": "Wing",
        "french": "Wing",
        "german": "Wing",
        "italian": "Wing",
        "spanish": "Wing"
      }
    },
    "special_move": {
      "kind": "special_move",
      "source_offset": "0x00079E48",
      "runtime_address": "0x08079E48",
      "pointers": [
        "0x0833CA6C",
        "0x0833CA6C",
        "0x0833CA6C",
        "0x0833CA6C",
        "0x0833CA6C"
      ],
      "names": {
        "english": "Wing Flux Summon",
        "french": "Wing Flux Summon",
        "german": "Wing Flux Summon",
        "italian": "Wing Flux Summon",
        "spanish": "Wing Flux Summon"
      }
    },
    "confidence": "strongly_supported"
  },
  {
    "pair_id": 9,
    "bit_beast": {
      "kind": "bit_beast",
      "source_offset": "0x00079E5C",
      "runtime_address": "0x08079E5C",
      "pointers": [
        "0x0833CA80",
        "0x0833CA80",
        "0x0833CA80",
        "0x0833CA80",
        "0x0833CA80"
      ],
      "names": {
        "english": "Wing",
        "french": "Wing",
        "german": "Wing",
        "italian": "Wing",
        "spanish": "Wing"
      }
    },
    "special_move": {
      "kind": "special_move",
      "source_offset": "0x00079E70",
      "runtime_address": "0x08079E70",
      "pointers": [
        "0x0833CA6C",
        "0x0833CA6C",
        "0x0833CA6C",
        "0x0833CA6C",
        "0x0833CA6C"
      ],
      "names": {
        "english": "Wing Flux Summon",
        "french": "Wing Flux Summon",
        "german": "Wing Flux Summon",
        "italian": "Wing Flux Summon",
        "spanish": "Wing Flux Summon"
      }
    },
    "confidence": "strongly_supported"
  },
  {
    "pair_id": 10,
    "bit_beast": {
      "kind": "bit_beast",
      "source_offset": "0x00079E84",
      "runtime_address": "0x08079E84",
      "pointers": [
        "0x0833CA64",
        "0x0833CA64",